question,db,lbl,sql,diff,related_tab_cnts,answer,related_tabs
Provide the number of games sold in North America on the PS4 platform.,video_games,110,SELECT SUM(T1.num_sales * 100000) FROM region_sales AS T1 INNER JOIN region AS T2 ON T1.region_id = T2.id INNER JOIN game_platform AS T3 ON T1.game_platform_id = T3.id INNER JOIN platform AS T4 ON T3.platform_id = T4.id WHERE T2.region_name = 'North America' AND T4.platform_name = 'PS4',,4,9680000.0,video_games#sep#platform [TAB] video_games#sep#region#sep#region [TAB] video_games#sep#region_sales#sep#region_sales6 [TAB] video_games#sep#region_sales#sep#region_sales3 [TAB] video_games#sep#region_sales#sep#region_sales0 [TAB] video_games#sep#region_sales#sep#region_sales4 [TAB] video_games#sep#region_sales#sep#region_sales7 [TAB] video_games#sep#region_sales#sep#region_sales2 [TAB] video_games#sep#region_sales#sep#region_sales5 [TAB] video_games#sep#region_sales#sep#region_sales1 [TAB] video_games#sep#game_platform#sep#game_platform0 [TAB] video_games#sep#game_platform#sep#game_platform6 [TAB] video_games#sep#game_platform#sep#game_platform5 [TAB] video_games#sep#game_platform#sep#game_platform2 [TAB] video_games#sep#game_platform#sep#game_platform3 [TAB] video_games#sep#game_platform#sep#game_platform4 [TAB] video_games#sep#game_platform#sep#game_platform1 [TAB] video_games#sep#game_platform#sep#game_platform7
How many games can be played on the Wii platform?,video_games,1,SELECT COUNT(T1.id) FROM game_platform AS T1 INNER JOIN platform AS T2 ON T1.platform_id = T2.id WHERE T2.platform_name = 'Wii',,2,1290.0,video_games#sep#platform [TAB] video_games#sep#game_platform#sep#game_platform0 [TAB] video_games#sep#game_platform#sep#game_platform6 [TAB] video_games#sep#game_platform#sep#game_platform5 [TAB] video_games#sep#game_platform#sep#game_platform2 [TAB] video_games#sep#game_platform#sep#game_platform3 [TAB] video_games#sep#game_platform#sep#game_platform4 [TAB] video_games#sep#game_platform#sep#game_platform1 [TAB] video_games#sep#game_platform#sep#game_platform7
"How many different publishers have published a game that starts with ""Marvel""?",video_games,1,SELECT COUNT(DISTINCT T1.publisher_id) FROM game_publisher AS T1 INNER JOIN game AS T2 ON T1.game_id = T2.id WHERE T2.game_name LIKE 'Marvel%',,2,8.0,video_games#sep#game_publisher#sep#game_publisher [TAB] video_games#sep#game#sep#game
How many publishers published the Minecraft game?,video_games,1,SELECT COUNT(T2.publisher_id) FROM game AS T1 INNER JOIN game_publisher AS T2 ON T1.id = T2.game_id WHERE T1.game_name = 'Minecraft',,2,3.0,video_games#sep#game_publisher#sep#game_publisher [TAB] video_games#sep#game#sep#game
What is the number of games sold in Europe for game platform ID 26?,video_games,11,SELECT T2.num_sales * 100000 AS nums_eur FROM region AS T1 INNER JOIN region_sales AS T2 ON T1.id = T2.region_id WHERE T2.game_platform_id = 26 AND T1.region_name = 'Europe',,2,12000.0,video_games#sep#region#sep#region [TAB] video_games#sep#region_sales#sep#region_sales6 [TAB] video_games#sep#region_sales#sep#region_sales3 [TAB] video_games#sep#region_sales#sep#region_sales0 [TAB] video_games#sep#region_sales#sep#region_sales4 [TAB] video_games#sep#region_sales#sep#region_sales7 [TAB] video_games#sep#region_sales#sep#region_sales2 [TAB] video_games#sep#region_sales#sep#region_sales5 [TAB] video_games#sep#region_sales#sep#region_sales1
"How many games are not of the genres 'Role-Playing', 'Shooter' and 'Simulation'?",video_games,1,"SELECT COUNT(T2.id) FROM genre AS T1 INNER JOIN game AS T2 ON T1.id = T2.genre_id WHERE T1.genre_name NOT IN ('Role-Playing', 'Shooter', 'Simulation')",,2,8603.0,video_games#sep#genre [TAB] video_games#sep#game#sep#game
How many games were sold on PS3 platform in Japan?,video_games,110,SELECT SUM(T1.num_sales * 100000) FROM region_sales AS T1 INNER JOIN region AS T2 ON T1.region_id = T2.id INNER JOIN game_platform AS T3 ON T1.game_platform_id = T3.id INNER JOIN platform AS T4 ON T3.platform_id = T4.id WHERE T2.region_name = 'Japan' AND T4.platform_name = 'PS3',,4,7921000.0,video_games#sep#platform [TAB] video_games#sep#region#sep#region [TAB] video_games#sep#region_sales#sep#region_sales6 [TAB] video_games#sep#region_sales#sep#region_sales3 [TAB] video_games#sep#region_sales#sep#region_sales0 [TAB] video_games#sep#region_sales#sep#region_sales4 [TAB] video_games#sep#region_sales#sep#region_sales7 [TAB] video_games#sep#region_sales#sep#region_sales2 [TAB] video_games#sep#region_sales#sep#region_sales5 [TAB] video_games#sep#region_sales#sep#region_sales1 [TAB] video_games#sep#game_platform#sep#game_platform0 [TAB] video_games#sep#game_platform#sep#game_platform6 [TAB] video_games#sep#game_platform#sep#game_platform5 [TAB] video_games#sep#game_platform#sep#game_platform2 [TAB] video_games#sep#game_platform#sep#game_platform3 [TAB] video_games#sep#game_platform#sep#game_platform4 [TAB] video_games#sep#game_platform#sep#game_platform1 [TAB] video_games#sep#game_platform#sep#game_platform7
"In 2010, how many PS3 games were released?",video_games,11,SELECT COUNT(T3.game_id) FROM platform AS T1 INNER JOIN game_platform AS T2 ON T1.id = T2.platform_id INNER JOIN game_publisher AS T3 ON T2.game_publisher_id = T3.id WHERE T1.platform_name = 'PS3' AND T2.release_year = 2010,,3,181.0,video_games#sep#platform [TAB] video_games#sep#game_publisher#sep#game_publisher [TAB] video_games#sep#game_platform#sep#game_platform0 [TAB] video_games#sep#game_platform#sep#game_platform6 [TAB] video_games#sep#game_platform#sep#game_platform5 [TAB] video_games#sep#game_platform#sep#game_platform2 [TAB] video_games#sep#game_platform#sep#game_platform3 [TAB] video_games#sep#game_platform#sep#game_platform4 [TAB] video_games#sep#game_platform#sep#game_platform1 [TAB] video_games#sep#game_platform#sep#game_platform7
How many shooter games are there?,video_games,1,SELECT COUNT(T1.id) FROM game AS T1 INNER JOIN genre AS T2 ON T1.genre_id = T2.id WHERE T2.genre_name = 'Shooter',,2,804.0,video_games#sep#genre [TAB] video_games#sep#game#sep#game
How many game publisher IDs have published games on the X360 platform?,video_games,1,SELECT COUNT(T1.game_publisher_id) FROM game_platform AS T1 INNER JOIN platform AS T2 ON T1.platform_id = T2.id WHERE T2.platform_name = 'X360',,2,1235.0,video_games#sep#platform [TAB] video_games#sep#game_platform#sep#game_platform0 [TAB] video_games#sep#game_platform#sep#game_platform6 [TAB] video_games#sep#game_platform#sep#game_platform5 [TAB] video_games#sep#game_platform#sep#game_platform2 [TAB] video_games#sep#game_platform#sep#game_platform3 [TAB] video_games#sep#game_platform#sep#game_platform4 [TAB] video_games#sep#game_platform#sep#game_platform1 [TAB] video_games#sep#game_platform#sep#game_platform7
Calculate the total number of IDs for the game published by Capcom and Sony Computer Entertainment.,video_games,1,"SELECT COUNT(DISTINCT T1.game_id) FROM game_publisher AS T1 INNER JOIN publisher AS T2 ON T1.publisher_id = T2.id WHERE T2.publisher_name IN ('Capcom', 'Sony Computer Entertainment')",,2,894.0,video_games#sep#publisher#sep#publisher [TAB] video_games#sep#game_publisher#sep#game_publisher
Calculate the number of games in the fighting genre.,video_games,1,SELECT COUNT(T1.id) FROM game AS T1 INNER JOIN genre AS T2 ON T1.genre_id = T2.id WHERE T2.genre_name = 'Fighting',,2,605.0,video_games#sep#genre [TAB] video_games#sep#game#sep#game
Calculate the total sales made by the games released in 2000.,video_games,1,SELECT SUM(T1.num_sales) FROM region_sales AS T1 INNER JOIN game_platform AS T2 ON T1.game_platform_id = T2.id WHERE T2.release_year = 2000,,2,201.62999999999988,video_games#sep#region_sales#sep#region_sales6 [TAB] video_games#sep#region_sales#sep#region_sales3 [TAB] video_games#sep#region_sales#sep#region_sales0 [TAB] video_games#sep#region_sales#sep#region_sales4 [TAB] video_games#sep#region_sales#sep#region_sales7 [TAB] video_games#sep#region_sales#sep#region_sales2 [TAB] video_games#sep#region_sales#sep#region_sales5 [TAB] video_games#sep#region_sales#sep#region_sales1 [TAB] video_games#sep#game_platform#sep#game_platform0 [TAB] video_games#sep#game_platform#sep#game_platform6 [TAB] video_games#sep#game_platform#sep#game_platform5 [TAB] video_games#sep#game_platform#sep#game_platform2 [TAB] video_games#sep#game_platform#sep#game_platform3 [TAB] video_games#sep#game_platform#sep#game_platform4 [TAB] video_games#sep#game_platform#sep#game_platform1 [TAB] video_games#sep#game_platform#sep#game_platform7
What is the total number of adventure games released in 2005?,video_games,101,SELECT COUNT(DISTINCT T3.id) FROM game_platform AS T1 INNER JOIN game_publisher AS T2 ON T1.game_publisher_id = T2.id INNER JOIN game AS T3 ON T2.game_id = T3.id INNER JOIN genre AS T4 ON T3.genre_id = T4.id WHERE T4.genre_name = 'Adventure' AND T1.release_year = 2005,,4,29.0,video_games#sep#genre [TAB] video_games#sep#game_publisher#sep#game_publisher [TAB] video_games#sep#game#sep#game [TAB] video_games#sep#game_platform#sep#game_platform0 [TAB] video_games#sep#game_platform#sep#game_platform6 [TAB] video_games#sep#game_platform#sep#game_platform5 [TAB] video_games#sep#game_platform#sep#game_platform2 [TAB] video_games#sep#game_platform#sep#game_platform3 [TAB] video_games#sep#game_platform#sep#game_platform4 [TAB] video_games#sep#game_platform#sep#game_platform1 [TAB] video_games#sep#game_platform#sep#game_platform7
How many games available on PSP were released in 2004?,video_games,11,SELECT COUNT(T3.game_id) FROM platform AS T1 INNER JOIN game_platform AS T2 ON T1.id = T2.platform_id INNER JOIN game_publisher AS T3 ON T2.game_publisher_id = T3.id WHERE T1.platform_name = 'PSP' AND T2.release_year = 2004,,3,15.0,video_games#sep#platform [TAB] video_games#sep#game_publisher#sep#game_publisher [TAB] video_games#sep#game_platform#sep#game_platform0 [TAB] video_games#sep#game_platform#sep#game_platform6 [TAB] video_games#sep#game_platform#sep#game_platform5 [TAB] video_games#sep#game_platform#sep#game_platform2 [TAB] video_games#sep#game_platform#sep#game_platform3 [TAB] video_games#sep#game_platform#sep#game_platform4 [TAB] video_games#sep#game_platform#sep#game_platform1 [TAB] video_games#sep#game_platform#sep#game_platform7
How many papers were written by authors who cooperated with University of Hong Kong?,authors,1,SELECT COUNT(T2.PaperId) FROM Author AS T1 INNER JOIN PaperAuthor AS T2 ON T1.Id = T2.AuthorId WHERE T1.Affiliation = 'University of Hong Kong',,2,754.0,authors#sep#PaperAuthor#sep#PaperAuthor [TAB] authors#sep#Author#sep#Author
"In total, how many Hispanic male students graduated from Amridge University?",college_completion,11,SELECT SUM(T2.grad_cohort) FROM institution_details AS T1 INNER JOIN institution_grads AS T2 ON T1.unitid = T2.unitid WHERE T1.chronname = 'Amridge University' AND T2.gender = 'M' AND T2.race = 'H',,2,0.0,college_completion#sep#institution_details [TAB] college_completion#sep#institution_grads
"How many more ""buffets"" than ""gyms"" in Yelp business?",public_review_platform,0,SELECT SUM(CASE WHEN T1.category_name LIKE 'Buffets' THEN 1 ELSE 0 END) - SUM(CASE WHEN T1.category_name LIKE 'Gyms' THEN 1 ELSE 0 END) FROM Categories AS T1 INNER JOIN Business_Categories AS T2 ON T1.category_id = T2.category_id,,2,-6.0,public_review_platform#sep#Business_Categories#sep#Business_Categories [TAB] public_review_platform#sep#Categories#sep#Categories
How many Yelp_Businesses do not provide alcohol?,public_review_platform,11,SELECT COUNT(T1.attribute_id) FROM Attributes AS T1 INNER JOIN Business_Attributes AS T2 ON T1.attribute_id = T2.attribute_id WHERE T1.attribute_name LIKE 'Alcohol' AND T2.attribute_value LIKE 'none',,2,2214.0,public_review_platform#sep#Attributes#sep#Attributes [TAB] public_review_platform#sep#Business_Attributes#sep#Business_Attributes
How many Yelp_Business close after 8PM on Mondays?,public_review_platform,11,SELECT COUNT(T1.business_id) FROM Business_Hours AS T1 INNER JOIN Days AS T2 ON T1.day_id = T2.day_id WHERE T2.day_of_week LIKE 'Monday' AND T1.closing_time > '8PM',,2,1477.0,public_review_platform#sep#Days#sep#Days [TAB] public_review_platform#sep#Business_Hours
How many businesses have a romantic ambiance?,public_review_platform,11,SELECT COUNT(T2.business_id) FROM Attributes AS T1 INNER JOIN Business_Attributes AS T2 ON T1.attribute_id = T2.attribute_id WHERE T2.attribute_value = 'true' AND T1.attribute_name = 'ambience_romantic',,2,86.0,public_review_platform#sep#Attributes#sep#Attributes [TAB] public_review_platform#sep#Business_Attributes#sep#Business_Attributes
How many businesses accept insurance?,public_review_platform,11,SELECT COUNT(T1.business_id) FROM Business_Attributes AS T1 INNER JOIN Attributes AS T2 ON T1.attribute_id = T2.attribute_id WHERE T2.attribute_name = 'Accepts Insurance' AND T1.attribute_value = 'true',,2,13.0,public_review_platform#sep#Business_Attributes#sep#Business_Attributes [TAB] public_review_platform#sep#Attributes#sep#Attributes
"What is the percentage for the Yelp businesses in ""Pets"" category of all businesses?",public_review_platform,0,SELECT CAST(SUM(CASE WHEN T2.category_name = 'Pets' THEN 1 ELSE 0 END) AS REAL) * 100 / COUNT(T2.category_name) FROM Business_Categories AS T1 INNER JOIN Categories AS T2 ON T1.category_id = T2.category_id,,2,0.704757110495847,public_review_platform#sep#Business_Categories#sep#Business_Categories [TAB] public_review_platform#sep#Categories#sep#Categories
"How many times is the number of ""Women's Clothing"" Yelp businesses to ""Men's Clothing""?",public_review_platform,0,SELECT CAST(SUM(CASE WHEN T2.category_name = 'Women''s Clothing' THEN 1 ELSE 0 END) AS REAL) / SUM(CASE WHEN T2.category_name = 'Men''s Clothing' THEN 1 ELSE 0 END) AS TIMES FROM Business_Categories AS T1 INNER JOIN Categories AS T2 ON T1.category_id = T2.category_id,,2,1.923728813559322,public_review_platform#sep#Business_Categories#sep#Business_Categories [TAB] public_review_platform#sep#Categories#sep#Categories
"Calculate the percentage of business with attribute name of ""Accepts Credit Cards"".",public_review_platform,0,SELECT CAST(SUM(CASE WHEN T1.attribute_name = 'Accepts Credit Cards' THEN 1 ELSE 0 END) AS REAL) * 100 / COUNT(T1.attribute_name) FROM Attributes AS T1 INNER JOIN Business_Attributes AS T2 ON T1.attribute_id = T2.attribute_id,,2,5.204557975006524,public_review_platform#sep#Attributes#sep#Attributes [TAB] public_review_platform#sep#Business_Attributes#sep#Business_Attributes
"Compare the number of business between the category of ""Men's Clothing"" and ""Women's Clothing"".",public_review_platform,0,SELECT SUM(CASE WHEN T1.category_name = 'Men''s Clothing' THEN 1 ELSE 0 END) - SUM(CASE WHEN T1.category_name = 'Women''s Clothing' THEN 1 ELSE 0 END) AS diff FROM Categories AS T1 INNER JOIN Business_Categories AS T2 ON T1.category_id = T2.category_id,,2,-109.0,public_review_platform#sep#Business_Categories#sep#Business_Categories [TAB] public_review_platform#sep#Categories#sep#Categories
What is the ratio between business in shopping category and business in pets category?,public_review_platform,0,SELECT CAST(SUM(CASE WHEN T2.category_name = 'Shopping' THEN 1 ELSE 0 END) AS REAL) / SUM(CASE WHEN T2.category_name = 'Pets' THEN 1 ELSE 0 END) AS radio FROM Business_Categories AS T1 INNER JOIN Categories AS T2 ON T1.category_id = T2.category_id,,2,8.113636363636363,public_review_platform#sep#Business_Categories#sep#Business_Categories [TAB] public_review_platform#sep#Categories#sep#Categories
How many businesses are registered in the database under 'Banks & Credit Unions' category?,public_review_platform,1,SELECT COUNT(T2.business_id) FROM Categories AS T1 INNER JOIN Business_Categories AS T2 ON T1.category_id = T2.category_id WHERE T1.category_name = 'Banks & Credit Unions',,2,94.0,public_review_platform#sep#Business_Categories#sep#Business_Categories [TAB] public_review_platform#sep#Categories#sep#Categories
How many businesses that are registered in the database can be attributed to 'Good for Kids'?,public_review_platform,11,SELECT COUNT(T2.business_id) FROM Attributes AS T1 INNER JOIN Business_Attributes AS T2 ON T1.attribute_id = T2.attribute_id WHERE T1.attribute_name = 'Good for Kids' AND T2.attribute_value = 'true',,2,4720.0,public_review_platform#sep#Attributes#sep#Attributes [TAB] public_review_platform#sep#Business_Attributes#sep#Business_Attributes
"Sum up the number of business with ""ambience_romantic"" attribute.",public_review_platform,11,SELECT COUNT(T2.business_id) FROM Attributes AS T1 INNER JOIN Business_Attributes AS T2 ON T1.attribute_id = T2.attribute_id WHERE T1.attribute_name = 'ambience_romantic' AND T2.attribute_value = 'true',,2,86.0,public_review_platform#sep#Attributes#sep#Attributes [TAB] public_review_platform#sep#Business_Attributes#sep#Business_Attributes
In how many businesses with the ambience_trendy attribute?,public_review_platform,11,"SELECT COUNT(T2.business_id) FROM Attributes AS T1 INNER JOIN Business_Attributes AS T2 ON T1.attribute_id = T2.attribute_id WHERE T1.attribute_name = 'ambience_trendy' AND T2.attribute_value IN ('none', 'no', 'false')",,2,3855.0,public_review_platform#sep#Attributes#sep#Attributes [TAB] public_review_platform#sep#Business_Attributes#sep#Business_Attributes
What is the total number of word cited under that class labelled 'AI'?,citeseer,1,SELECT COUNT(DISTINCT T2.word_cited_id) FROM paper AS T1 INNER JOIN content AS T2 ON T1.paper_id = T2.paper_id WHERE T1.class_label = 'AI',,2,1979.0,citeseer#sep#content [TAB] citeseer#sep#paper#sep#paper2 [TAB] citeseer#sep#paper#sep#paper3 [TAB] citeseer#sep#paper#sep#paper1 [TAB] citeseer#sep#paper#sep#paper5 [TAB] citeseer#sep#paper#sep#paper0 [TAB] citeseer#sep#paper#sep#paper4
How many papers were cited by schmidt99advanced cited word3555?,citeseer,11,SELECT COUNT(T2.paper_id) FROM cites AS T1 INNER JOIN content AS T2 ON T1.cited_paper_id = T2.paper_id WHERE T1.citing_paper_id = 'schmidt99advanced' AND T2.word_cited_id = 'word3555',,2,0.0,citeseer#sep#cites [TAB] citeseer#sep#content
"In the papers classified as ML, how many cited butz01algorithmic?",citeseer,11,SELECT COUNT(T1.paper_id) FROM paper AS T1 INNER JOIN cites AS T2 ON T1.paper_id = T2.citing_paper_id WHERE T1.class_label = 'ML' AND T2.cited_paper_id = 'butz01algorithmic',,2,1.0,citeseer#sep#cites [TAB] citeseer#sep#paper#sep#paper2 [TAB] citeseer#sep#paper#sep#paper3 [TAB] citeseer#sep#paper#sep#paper1 [TAB] citeseer#sep#paper#sep#paper5 [TAB] citeseer#sep#paper#sep#paper0 [TAB] citeseer#sep#paper#sep#paper4
How many keywords does the episode that was aired on 2008/10/19 have?,simpson_episodes,1,SELECT COUNT(T2.keyword) FROM Episode AS T1 INNER JOIN Keyword AS T2 ON T1.episode_id = T2.episode_id WHERE T1.air_date = '2008-10-19';,,2,9.0,simpson_episodes#sep#Keyword#sep#Keyword [TAB] simpson_episodes#sep#Episode#sep#Episode
"Among the students from the navy department, how many of them have payment due?",student_loan,11,SELECT COUNT(T1.name) FROM enlist AS T1 INNER JOIN no_payment_due AS T2 ON T1.`name` = T2.`name` WHERE T1.organ = 'navy' AND T2.bool = 'pos',,2,37.0,student_loan#sep#no_payment_due#sep#no_payment_due0 [TAB] student_loan#sep#no_payment_due#sep#no_payment_due1 [TAB] student_loan#sep#enlist#sep#enlist1 [TAB] student_loan#sep#enlist#sep#enlist6 [TAB] student_loan#sep#enlist#sep#enlist4 [TAB] student_loan#sep#enlist#sep#enlist5 [TAB] student_loan#sep#enlist#sep#enlist2 [TAB] student_loan#sep#enlist#sep#enlist3 [TAB] student_loan#sep#enlist#sep#enlist0
Count the number of students from UCSD enlisted in the peace corps.,student_loan,11,SELECT COUNT(T1.name) FROM enlist AS T1 INNER JOIN enrolled AS T2 ON T1.`name` = T2.`name` WHERE T2.school = 'ucsd' AND T1.organ = 'peace_corps',,2,5.0,student_loan#sep#enrolled#sep#enrolled0 [TAB] student_loan#sep#enrolled#sep#enrolled4 [TAB] student_loan#sep#enrolled#sep#enrolled1 [TAB] student_loan#sep#enrolled#sep#enrolled2 [TAB] student_loan#sep#enrolled#sep#enrolled3 [TAB] student_loan#sep#enrolled#sep#enrolled5 [TAB] student_loan#sep#enlist#sep#enlist1 [TAB] student_loan#sep#enlist#sep#enlist6 [TAB] student_loan#sep#enlist#sep#enlist4 [TAB] student_loan#sep#enlist#sep#enlist5 [TAB] student_loan#sep#enlist#sep#enlist2 [TAB] student_loan#sep#enlist#sep#enlist3 [TAB] student_loan#sep#enlist#sep#enlist0
How many SMC's students that absent for 7 months?,student_loan,11,SELECT COUNT(T1.name) FROM enrolled AS T1 INNER JOIN longest_absense_from_school AS T2 ON T1.name = T2.name WHERE T1.school = 'smc' AND T2.month = 7,,2,22.0,student_loan#sep#longest_absense_from_school#sep#longest_absense_from_school4 [TAB] student_loan#sep#longest_absense_from_school#sep#longest_absense_from_school2 [TAB] student_loan#sep#longest_absense_from_school#sep#longest_absense_from_school3 [TAB] student_loan#sep#longest_absense_from_school#sep#longest_absense_from_school6 [TAB] student_loan#sep#longest_absense_from_school#sep#longest_absense_from_school0 [TAB] student_loan#sep#longest_absense_from_school#sep#longest_absense_from_school1 [TAB] student_loan#sep#longest_absense_from_school#sep#longest_absense_from_school5 [TAB] student_loan#sep#longest_absense_from_school#sep#longest_absense_from_school7 [TAB] student_loan#sep#enrolled#sep#enrolled0 [TAB] student_loan#sep#enrolled#sep#enrolled4 [TAB] student_loan#sep#enrolled#sep#enrolled1 [TAB] student_loan#sep#enrolled#sep#enrolled2 [TAB] student_loan#sep#enrolled#sep#enrolled3 [TAB] student_loan#sep#enrolled#sep#enrolled5
Calculate the ratio between unemployed students and disabled students.,student_loan,0,SELECT CAST(( SELECT COUNT(name) FROM unemployed ) AS REAL ) / ( SELECT COUNT(name) FROM disabled ),,2,1.0315789473684212,student_loan#sep#disabled#sep#disabled [TAB] student_loan#sep#unemployed#sep#unemployed
How many students are enlisted in the Peace Corps organization are enrolled in UCSD school?,student_loan,11,SELECT COUNT(T1.name) FROM enlist AS T1 INNER JOIN enrolled AS T2 ON T1.name = T2.name WHERE T1.organ = 'peace_corps' AND T2.school = 'ucsd',,2,5.0,student_loan#sep#enrolled#sep#enrolled0 [TAB] student_loan#sep#enrolled#sep#enrolled4 [TAB] student_loan#sep#enrolled#sep#enrolled1 [TAB] student_loan#sep#enrolled#sep#enrolled2 [TAB] student_loan#sep#enrolled#sep#enrolled3 [TAB] student_loan#sep#enrolled#sep#enrolled5 [TAB] student_loan#sep#enlist#sep#enlist1 [TAB] student_loan#sep#enlist#sep#enlist6 [TAB] student_loan#sep#enlist#sep#enlist4 [TAB] student_loan#sep#enlist#sep#enlist5 [TAB] student_loan#sep#enlist#sep#enlist2 [TAB] student_loan#sep#enlist#sep#enlist3 [TAB] student_loan#sep#enlist#sep#enlist0
How many students is disabled and unemployed at the same time?,student_loan,0,SELECT COUNT(T1.name) FROM disabled AS T1 INNER JOIN unemployed AS T2 ON T2.name = T1.name,,2,13.0,student_loan#sep#disabled#sep#disabled [TAB] student_loan#sep#unemployed#sep#unemployed
How many disabled students are male?,student_loan,0,SELECT COUNT(T1.name) FROM male AS T1 INNER JOIN disabled AS T2 ON T1.name = T2.name,,2,47.0,student_loan#sep#male#sep#male [TAB] student_loan#sep#disabled#sep#disabled
"Among students with 1 month of absenses, how many of them are enlisted in the air force department?",student_loan,11,SELECT COUNT(T1.name) FROM longest_absense_from_school AS T1 INNER JOIN enlist AS T2 ON T1.name = T2.name WHERE T1.month = 1 AND T2.organ = 'air_force',,2,3.0,student_loan#sep#longest_absense_from_school#sep#longest_absense_from_school4 [TAB] student_loan#sep#longest_absense_from_school#sep#longest_absense_from_school2 [TAB] student_loan#sep#longest_absense_from_school#sep#longest_absense_from_school3 [TAB] student_loan#sep#longest_absense_from_school#sep#longest_absense_from_school6 [TAB] student_loan#sep#longest_absense_from_school#sep#longest_absense_from_school0 [TAB] student_loan#sep#longest_absense_from_school#sep#longest_absense_from_school1 [TAB] student_loan#sep#longest_absense_from_school#sep#longest_absense_from_school5 [TAB] student_loan#sep#longest_absense_from_school#sep#longest_absense_from_school7 [TAB] student_loan#sep#enlist#sep#enlist1 [TAB] student_loan#sep#enlist#sep#enlist6 [TAB] student_loan#sep#enlist#sep#enlist4 [TAB] student_loan#sep#enlist#sep#enlist5 [TAB] student_loan#sep#enlist#sep#enlist2 [TAB] student_loan#sep#enlist#sep#enlist3 [TAB] student_loan#sep#enlist#sep#enlist0
How many of the unemployed students are disabled?,student_loan,0,SELECT COUNT(T1.name) FROM unemployed AS T1 INNER JOIN disabled AS T2 ON T1.name = T2.name,,2,13.0,student_loan#sep#disabled#sep#disabled [TAB] student_loan#sep#unemployed#sep#unemployed
How many users believed that their productivity is ever affected by a mental health issue overall?,mental_health_survey,11,SELECT COUNT(T1.UserID) FROM Answer AS T1 INNER JOIN Question AS T2 ON T1.QuestionID = T2.questionid WHERE T2.questionid = 54 AND T1.AnswerText LIKE 'Yes',,2,367.0,mental_health_survey#sep#Question#sep#Question [TAB] mental_health_survey#sep#Answer#sep#Answer
How many users participated in the mental health survey for 2014?,mental_health_survey,1,SELECT COUNT(DISTINCT T1.UserID) FROM Answer AS T1 INNER JOIN Survey AS T2 ON T1.SurveyID = T2.SurveyID WHERE T2.Description = 'mental health survey for 2014',,2,1260.0,mental_health_survey#sep#Answer#sep#Answer [TAB] mental_health_survey#sep#Survey#sep#Survey
How many users lived in Canada according to 2018's survey?,mental_health_survey,11,SELECT COUNT(T2.UserID) FROM Question AS T1 INNER JOIN Answer AS T2 ON T1.questionid = T2.QuestionID WHERE T2.SurveyID = 2018 AND T1.questiontext = 'What country do you live in?' AND T2.AnswerText = 'Canada',,2,8.0,mental_health_survey#sep#Question#sep#Question [TAB] mental_health_survey#sep#Answer#sep#Answer
