question,db,lbl,sql,diff,related_tab_cnts,answer,related_tabs
"Among the cities with area code 608, how many cities implement daylight savings?",address,11,SELECT COUNT(T2.city) FROM area_code AS T1 INNER JOIN zip_data AS T2 ON T1.zip_code = T2.zip_code WHERE T1.area_code = 608 AND T2.daylight_savings = 'Yes',,2,222.0,address#sep#area_code#sep#area_code1 [TAB] address#sep#area_code#sep#area_code8 [TAB] address#sep#area_code#sep#area_code5 [TAB] address#sep#area_code#sep#area_code7 [TAB] address#sep#area_code#sep#area_code6 [TAB] address#sep#area_code#sep#area_code3 [TAB] address#sep#area_code#sep#area_code2 [TAB] address#sep#area_code#sep#area_code4 [TAB] address#sep#area_code#sep#area_code0 [TAB] address#sep#zip_data#sep#zip_data_location1 [TAB] address#sep#zip_data#sep#zip_data_location0
Provide the average elevation of the cities with alias Amherst.,address,1,SELECT AVG(T2.elevation) FROM alias AS T1 INNER JOIN zip_data AS T2 ON T1.zip_code = T2.zip_code WHERE T1.alias = 'Amherst',,2,1259.5454545454545,address#sep#zip_data#sep#zip_data_location1 [TAB] address#sep#zip_data#sep#zip_data_location0 [TAB] address#sep#alias#sep#alias
What is the difference in the number of cities with P.O. box only and cities with Post Office among the cities with area code 787?,address,1,SELECT COUNT(CASE WHEN T2.type = 'P.O. Box Only' THEN 1 ELSE NULL END) - COUNT(CASE WHEN T2.type = 'Post Office' THEN 1 ELSE NULL END) AS DIFFERENCE FROM area_code AS T1 INNER JOIN zip_data AS T2 ON T1.zip_code = T2.zip_code WHERE T1.area_code = 787,,2,-64.0,address#sep#area_code#sep#area_code1 [TAB] address#sep#area_code#sep#area_code8 [TAB] address#sep#area_code#sep#area_code5 [TAB] address#sep#area_code#sep#area_code7 [TAB] address#sep#area_code#sep#area_code6 [TAB] address#sep#area_code#sep#area_code3 [TAB] address#sep#area_code#sep#area_code2 [TAB] address#sep#area_code#sep#area_code4 [TAB] address#sep#area_code#sep#area_code0 [TAB] address#sep#zip_data#sep#zip_data_location1 [TAB] address#sep#zip_data#sep#zip_data_location0
"Among the daylight savings areas in the Midwest region, how many postal points are there in Illinois?",address,11,SELECT COUNT(T2.zip_code) FROM state AS T1 INNER JOIN zip_data AS T2 ON T1.abbreviation = T2.state WHERE T1.name = 'Illinois' AND T2.daylight_savings = 'Yes' AND T2.region = 'Midwest',,2,1568.0,address#sep#zip_data#sep#zip_data_location1 [TAB] address#sep#zip_data#sep#zip_data_location0 [TAB] address#sep#state#sep#state
What was the population of Wilcox County in 2010?,address,1,SELECT SUM(T2.population_2010) FROM country AS T1 INNER JOIN zip_data AS T2 ON T1.zip_code = T2.zip_code WHERE T1.county = 'WILCOX',,2,71913.0,address#sep#country [TAB] address#sep#zip_data#sep#zip_data_demographics8 [TAB] address#sep#zip_data#sep#zip_data_demographics9 [TAB] address#sep#zip_data#sep#zip_data_demographics1 [TAB] address#sep#zip_data#sep#zip_data_demographics5 [TAB] address#sep#zip_data#sep#zip_data_demographics3 [TAB] address#sep#zip_data#sep#zip_data_demographics0 [TAB] address#sep#zip_data#sep#zip_data_demographics12 [TAB] address#sep#zip_data#sep#zip_data_demographics7 [TAB] address#sep#zip_data#sep#zip_data_demographics13 [TAB] address#sep#zip_data#sep#zip_data_demographics11 [TAB] address#sep#zip_data#sep#zip_data_demographics4 [TAB] address#sep#zip_data#sep#zip_data_demographics10 [TAB] address#sep#zip_data#sep#zip_data_demographics6 [TAB] address#sep#zip_data#sep#zip_data_demographics14 [TAB] address#sep#zip_data#sep#zip_data_demographics2
What is the average of the white population in the cities with area code 920?,address,1,SELECT AVG(T2.white_population) FROM area_code AS T1 INNER JOIN zip_data AS T2 ON T1.zip_code = T2.zip_code WHERE T1.area_code = 920,,2,6221.041025641026,address#sep#area_code#sep#area_code1 [TAB] address#sep#area_code#sep#area_code8 [TAB] address#sep#area_code#sep#area_code5 [TAB] address#sep#area_code#sep#area_code7 [TAB] address#sep#area_code#sep#area_code6 [TAB] address#sep#area_code#sep#area_code3 [TAB] address#sep#area_code#sep#area_code2 [TAB] address#sep#area_code#sep#area_code4 [TAB] address#sep#area_code#sep#area_code0 [TAB] address#sep#zip_data#sep#zip_data_demographics8 [TAB] address#sep#zip_data#sep#zip_data_demographics9 [TAB] address#sep#zip_data#sep#zip_data_demographics1 [TAB] address#sep#zip_data#sep#zip_data_demographics5 [TAB] address#sep#zip_data#sep#zip_data_demographics3 [TAB] address#sep#zip_data#sep#zip_data_demographics0 [TAB] address#sep#zip_data#sep#zip_data_demographics12 [TAB] address#sep#zip_data#sep#zip_data_demographics7 [TAB] address#sep#zip_data#sep#zip_data_demographics13 [TAB] address#sep#zip_data#sep#zip_data_demographics11 [TAB] address#sep#zip_data#sep#zip_data_demographics4 [TAB] address#sep#zip_data#sep#zip_data_demographics10 [TAB] address#sep#zip_data#sep#zip_data_demographics6 [TAB] address#sep#zip_data#sep#zip_data_demographics14 [TAB] address#sep#zip_data#sep#zip_data_demographics2
How many postal points with unique post office types are there in Ohio?,address,11,SELECT COUNT(T2.zip_code) FROM state AS T1 INNER JOIN zip_data AS T2 ON T1.abbreviation = T2.state WHERE T1.name = 'Ohio' AND T2.type = 'Unique Post Office',,2,80.0,address#sep#zip_data#sep#zip_data_location1 [TAB] address#sep#zip_data#sep#zip_data_location0 [TAB] address#sep#state#sep#state
What is the percentage of 5 star ratings River City brand root beer get?,beer_factory,1,SELECT CAST(COUNT(CASE WHEN T2.StarRating = 5 THEN 1 ELSE NULL END) AS REAL) * 100 / COUNT(T2.StarRating) FROM rootbeerbrand AS T1 INNER JOIN rootbeerreview AS T2 ON T1.BrandID = T2.BrandID WHERE T1.BrandName = 'River City',,2,28.03030303030303,beer_factory#sep#rootbeerreview [TAB] beer_factory#sep#rootbeerbrand#sep#rootbeerbrand
How many canned A&W were purchased in 2016?,beer_factory,11,SELECT COUNT(T1.BrandID) FROM rootbeer AS T1 INNER JOIN rootbeerbrand AS T2 ON T1.BrandID = T2.BrandID WHERE T1.ContainerType = 'Can' AND T2.BrandName = 'A&W' AND T1.PurchaseDate LIKE '2016%',,2,14.0,beer_factory#sep#rootbeer#sep#rootbeer0 [TAB] beer_factory#sep#rootbeer#sep#rootbeer1 [TAB] beer_factory#sep#rootbeerbrand#sep#rootbeerbrand
What is the amount difference between the bottles of root beer sold from Louisiana and Missouri?,beer_factory,11,SELECT ( SELECT COUNT(T1.BrandID) FROM rootbeer AS T1 INNER JOIN rootbeerbrand AS T2 ON T1.BrandID = T2.BrandID WHERE T2.State = 'LA' AND T1.ContainerType = 'Bottle' ) - ( SELECT COUNT(T3.BrandID) FROM rootbeer AS T3 INNER JOIN rootbeerbrand AS T4 ON T3.BrandID = T4.BrandID WHERE T4.State = 'MO' AND T3.ContainerType = 'Bottle' ) AS DIFFERENCE,,2,-561.0,beer_factory#sep#rootbeer#sep#rootbeer0 [TAB] beer_factory#sep#rootbeer#sep#rootbeer1 [TAB] beer_factory#sep#rootbeerbrand#sep#rootbeerbrand
How many times on page number 16 does the second word in the pair of words 1 and 109 appear?,language_corpus,11,SELECT SUM(T1.occurrences) FROM pages_words AS T1 INNER JOIN biwords AS T2 ON T2.w2nd = T1.wid WHERE T2.w2nd = 109 AND T2.w1st = 1 AND T1.pid = 16,,2,103.0,language_corpus#sep#pages_words [TAB] language_corpus#sep#biwords
State the total pages of the words that has repeated times of 2593.,language_corpus,1,SELECT COUNT(T1.pages) FROM langs AS T1 INNER JOIN langs_words AS T2 ON T1.lid = T2.lid WHERE T2.occurrences = 2593,,2,6.0,language_corpus#sep#langs_words#sep#langs_words5 [TAB] language_corpus#sep#langs_words#sep#langs_words6 [TAB] language_corpus#sep#langs_words#sep#langs_words17 [TAB] language_corpus#sep#langs_words#sep#langs_words8 [TAB] language_corpus#sep#langs_words#sep#langs_words13 [TAB] language_corpus#sep#langs_words#sep#langs_words2 [TAB] language_corpus#sep#langs_words#sep#langs_words0 [TAB] language_corpus#sep#langs_words#sep#langs_words9 [TAB] language_corpus#sep#langs_words#sep#langs_words15 [TAB] language_corpus#sep#langs_words#sep#langs_words11 [TAB] language_corpus#sep#langs_words#sep#langs_words12 [TAB] language_corpus#sep#langs_words#sep#langs_words10 [TAB] language_corpus#sep#langs_words#sep#langs_words3 [TAB] language_corpus#sep#langs_words#sep#langs_words16 [TAB] language_corpus#sep#langs_words#sep#langs_words18 [TAB] language_corpus#sep#langs_words#sep#langs_words7 [TAB] language_corpus#sep#langs_words#sep#langs_words1 [TAB] language_corpus#sep#langs_words#sep#langs_words19 [TAB] language_corpus#sep#langs_words#sep#langs_words4 [TAB] language_corpus#sep#langs_words#sep#langs_words14 [TAB] language_corpus#sep#langs#sep#langs
"How many appearances does the word ID No. 2823 have in the Wikipedia page ""Astre""?",language_corpus,11,SELECT SUM(T2.occurrences) FROM pages AS T1 INNER JOIN pages_words AS T2 ON T1.pid = T2.pid WHERE T1.title = 'Astre' AND T2.wid = 2823,,2,4.0,language_corpus#sep#pages_words [TAB] language_corpus#sep#pages#sep#pages_content1 [TAB] language_corpus#sep#pages#sep#pages_content3 [TAB] language_corpus#sep#pages#sep#pages_content4 [TAB] language_corpus#sep#pages#sep#pages_content9 [TAB] language_corpus#sep#pages#sep#pages_content7 [TAB] language_corpus#sep#pages#sep#pages_content12 [TAB] language_corpus#sep#pages#sep#pages_content5 [TAB] language_corpus#sep#pages#sep#pages_content11 [TAB] language_corpus#sep#pages#sep#pages_content10 [TAB] language_corpus#sep#pages#sep#pages_content6 [TAB] language_corpus#sep#pages#sep#pages_content0 [TAB] language_corpus#sep#pages#sep#pages_content8 [TAB] language_corpus#sep#pages#sep#pages_content2
"Among the biwords pairs with ""àbac"" as its first word, how many of them have an occurrence of over 10?",language_corpus,11,SELECT COUNT(T2.w2nd) FROM words AS T1 INNER JOIN biwords AS T2 ON T1.wid = T2.w1st WHERE T1.word = 'àbac' AND T2.occurrences > 10,,2,3.0,language_corpus#sep#biwords [TAB] language_corpus#sep#words#sep#words13 [TAB] language_corpus#sep#words#sep#words10 [TAB] language_corpus#sep#words#sep#words1 [TAB] language_corpus#sep#words#sep#words4 [TAB] language_corpus#sep#words#sep#words2 [TAB] language_corpus#sep#words#sep#words14 [TAB] language_corpus#sep#words#sep#words15 [TAB] language_corpus#sep#words#sep#words9 [TAB] language_corpus#sep#words#sep#words3 [TAB] language_corpus#sep#words#sep#words0 [TAB] language_corpus#sep#words#sep#words8 [TAB] language_corpus#sep#words#sep#words6 [TAB] language_corpus#sep#words#sep#words5 [TAB] language_corpus#sep#words#sep#words12 [TAB] language_corpus#sep#words#sep#words7 [TAB] language_corpus#sep#words#sep#words11
How many books are in English?,books,10,SELECT COUNT(*) FROM book AS T1 INNER JOIN book_language AS T2 ON T1.language_id = T2.language_id WHERE T2.language_name = 'English',,2,8911.0,books#sep#book_language#sep#book_language [TAB] books#sep#book#sep#book_language_and_pages2 [TAB] books#sep#book_language#sep#book_language [TAB] books#sep#book#sep#book_language_and_pages4 [TAB] books#sep#book#sep#book_language_and_pages7 [TAB] books#sep#book#sep#book_language_and_pages6 [TAB] books#sep#book#sep#book_language_and_pages1 [TAB] books#sep#book#sep#book_language_and_pages5 [TAB] books#sep#book#sep#book_language_and_pages0 [TAB] books#sep#book#sep#book_language_and_pages3
What is the total price of all the books ordered by Lucas Wyldbore?,books,1,SELECT SUM(T1.price) FROM order_line AS T1 INNER JOIN cust_order AS T2 ON T2.order_id = T1.order_id INNER JOIN customer AS T3 ON T3.customer_id = T2.customer_id WHERE T3.first_name = 'Lucas' AND T3.last_name = 'Wyldbore',,3,78.87,books#sep#cust_order [TAB] books#sep#order_line [TAB] books#sep#customer#sep#customer
"Among the books ordered by Lucas Wyldbore, what is the percentage of those books over $13?",books,1,SELECT CAST(SUM(CASE WHEN T1.price > 13 THEN 1 ELSE 0 END) AS REAL) * 100 / COUNT(*) FROM order_line AS T1 INNER JOIN cust_order AS T2 ON T2.order_id = T1.order_id INNER JOIN customer AS T3 ON T3.customer_id = T2.customer_id WHERE T3.first_name = 'Lucas' AND T3.last_name = 'Wyldbore',,3,33.333333333333336,books#sep#cust_order [TAB] books#sep#order_line [TAB] books#sep#customer#sep#customer
How many orders has Cordy Dumbarton made?,books,1,SELECT COUNT(*) FROM customer AS T1 INNER JOIN cust_order AS T2 ON T1.customer_id = T2.customer_id WHERE T1.first_name = 'Cordy' AND T1.last_name = 'Dumbarton',,2,8.0,books#sep#cust_order [TAB] books#sep#customer#sep#customer
Give the number of Ukrainian addresses in the database.,books,10,SELECT COUNT(*) FROM country AS T1 INNER JOIN address AS T2 ON T1.country_id = T2.country_id WHERE T1.country_name = 'Ukraine',,2,14.0,books#sep#country#sep#country [TAB] books#sep#address
Calculate the percentage of the International shipping orders on 2022/11/10.,books,1,SELECT CAST(SUM(CASE WHEN T1.method_name = 'International' THEN 1 ELSE 0 END) AS REAL) * 100 / COUNT(*) FROM shipping_method AS T1 INNER JOIN cust_order AS T2 ON T1.method_id = T2.shipping_method_id WHERE T2.order_date LIKE '2022-11-10%',,2,28.571428571428573,books#sep#cust_order [TAB] books#sep#shipping_method#sep#shipping_method
What is the average number of pages of David Coward's books?,books,1,SELECT AVG(T1.num_pages) FROM book AS T1 INNER JOIN book_author AS T2 ON T1.book_id = T2.book_id INNER JOIN author AS T3 ON T3.author_id = T2.author_id WHERE T3.author_name = 'David Coward',,3,280.0,books#sep#book_author#sep#book_author [TAB] books#sep#book#sep#book_language_and_pages2 [TAB] books#sep#book#sep#book_language_and_pages4 [TAB] books#sep#book#sep#book_language_and_pages7 [TAB] books#sep#book#sep#book_language_and_pages6 [TAB] books#sep#book#sep#book_language_and_pages1 [TAB] books#sep#book#sep#book_language_and_pages5 [TAB] books#sep#book#sep#book_language_and_pages0 [TAB] books#sep#book#sep#book_language_and_pages3 [TAB] books#sep#author#sep#author
"Among Daisey Lamball's orders, how many were shipped via International shipping?",books,11,SELECT COUNT(*) FROM customer AS T1 INNER JOIN cust_order AS T2 ON T1.customer_id = T2.customer_id INNER JOIN shipping_method AS T3 ON T3.method_id = T2.shipping_method_id WHERE T1.first_name = 'Daisey' AND T1.last_name = 'Lamball' AND T3.method_name = 'International',,3,3.0,books#sep#cust_order [TAB] books#sep#customer#sep#customer [TAB] books#sep#shipping_method#sep#shipping_method
How many orders did Antonia Poltun return?,books,11,SELECT COUNT(*) FROM order_status AS T1 INNER JOIN order_history AS T2 ON T1.status_id = T2.status_id INNER JOIN cust_order AS T3 ON T3.order_id = T2.order_id INNER JOIN customer AS T4 ON T4.customer_id = T3.customer_id WHERE T1.status_value = 'Returned' AND T4.first_name = 'Antonia' AND T4.last_name = 'Poltun',,4,1.0,books#sep#cust_order [TAB] books#sep#order_history#sep#order_history [TAB] books#sep#customer#sep#customer [TAB] books#sep#order_status#sep#order_status
How many books did A.R. Braunmuller write?,books,1,SELECT COUNT(*) FROM author AS T1 INNER JOIN book_author AS T2 ON T1.author_id = T2.author_id WHERE T1.author_name = 'A.R. Braunmuller',,2,4.0,books#sep#book_author#sep#book_author [TAB] books#sep#author#sep#author
How many of the books authored by Al Gore have less than 400 pages?,books,11,SELECT COUNT(*) FROM book AS T1 INNER JOIN book_author AS T2 ON T1.book_id = T2.book_id INNER JOIN author AS T3 ON T3.author_id = T2.author_id WHERE T3.author_name = 'Al Gore' AND T1.num_pages < 400,,3,1.0,books#sep#book_author#sep#book_author [TAB] books#sep#book#sep#book_language_and_pages2 [TAB] books#sep#book#sep#book_language_and_pages4 [TAB] books#sep#book#sep#book_language_and_pages7 [TAB] books#sep#book#sep#book_language_and_pages6 [TAB] books#sep#book#sep#book_language_and_pages1 [TAB] books#sep#book#sep#book_language_and_pages5 [TAB] books#sep#book#sep#book_language_and_pages0 [TAB] books#sep#book#sep#book_language_and_pages3 [TAB] books#sep#author#sep#author
How many books were published in Japanese?,books,1,SELECT COUNT(T2.book_id) FROM book_language AS T1 INNER JOIN book AS T2 ON T1.language_id = T2.language_id WHERE T1.language_name = 'Japanese',,2,46.0,books#sep#book_language [TAB] books#sep#book#sep#book_language_and_pages2 [TAB] books#sep#book#sep#book_language_and_pages4 [TAB] books#sep#book#sep#book_language_and_pages7 [TAB] books#sep#book#sep#book_language_and_pages6 [TAB] books#sep#book#sep#book_language_and_pages1 [TAB] books#sep#book#sep#book_language_and_pages5 [TAB] books#sep#book#sep#book_language_and_pages0 [TAB] books#sep#book#sep#book_language_and_pages3
How many customers are from Australia?,books,100,SELECT COUNT(*) FROM customer_address AS T1 INNER JOIN address AS T2 ON T2.address_id = T1.address_id INNER JOIN country AS T3 ON T3.country_id = T2.country_id WHERE T3.country_name = 'Australia',,3,5.0,books#sep#country#sep#country [TAB] books#sep#customer_address#sep#customer_address [TAB] books#sep#address
How many addresses are from the Philippines?,books,10,SELECT COUNT(T2.country_id) FROM address AS T1 INNER JOIN country AS T2 ON T2.country_id = T1.country_id WHERE T2.country_name = 'Philippines',,2,40.0,books#sep#country#sep#country [TAB] books#sep#address
How many of the customer addresses are inactive?,books,10,SELECT COUNT(*) FROM customer_address AS T1 INNER JOIN address_status AS T2 ON T1.status_id = T2.status_id WHERE T2.address_status = 'Inactive',,2,400.0,books#sep#address_status#sep#address_status [TAB] books#sep#customer_address#sep#customer_address
How many orders did Marcelia Goering place in 2021 that uses the Priority Shipping method?,books,111,"SELECT COUNT(*) FROM customer AS T1 INNER JOIN cust_order AS T2 ON T1.customer_id = T2.customer_id INNER JOIN shipping_method AS T3 ON T3.method_id = T2.shipping_method_id WHERE T1.first_name = 'Marcelia' AND T1.last_name = 'Goering' AND STRFTIME('%Y', T2.order_date) = '2021' AND T3.method_name = 'Priority'",,3,2.0,books#sep#cust_order [TAB] books#sep#customer#sep#customer [TAB] books#sep#shipping_method#sep#shipping_method
How many books have been published in Japanese?,books,10,SELECT COUNT(*) FROM book_language AS T1 INNER JOIN book AS T2 ON T1.language_id = T2.language_id WHERE T1.language_name = 'Japanese',,2,46.0,books#sep#book_language#sep#book_language [TAB] books#sep#book#sep#book_language_and_pages2 [TAB] books#sep#book_language#sep#book_language [TAB] books#sep#book#sep#book_language_and_pages4 [TAB] books#sep#book#sep#book_language_and_pages7 [TAB] books#sep#book#sep#book_language_and_pages6 [TAB] books#sep#book#sep#book_language_and_pages1 [TAB] books#sep#book#sep#book_language_and_pages5 [TAB] books#sep#book#sep#book_language_and_pages0 [TAB] books#sep#book#sep#book_language_and_pages3
What is the average number of pages in the books written by Jennifer Crusie?,books,1,SELECT AVG(T1.num_pages) FROM book AS T1 INNER JOIN book_author AS T2 ON T1.book_id = T2.book_id INNER JOIN author AS T3 ON T3.author_id = T2.author_id WHERE T3.author_name = 'Jennifer Crusie',,3,345.72727272727275,books#sep#book_author#sep#book_author [TAB] books#sep#book#sep#book_language_and_pages2 [TAB] books#sep#book#sep#book_language_and_pages4 [TAB] books#sep#book#sep#book_language_and_pages7 [TAB] books#sep#book#sep#book_language_and_pages6 [TAB] books#sep#book#sep#book_language_and_pages1 [TAB] books#sep#book#sep#book_language_and_pages5 [TAB] books#sep#book#sep#book_language_and_pages0 [TAB] books#sep#book#sep#book_language_and_pages3 [TAB] books#sep#author#sep#author
What percentage of the orders placed by Kaleena were shipped by the international method?,books,1,SELECT CAST(SUM(CASE WHEN T3.method_name = 'International' THEN 1 ELSE 0 END) AS REAL) * 100 / COUNT(*) FROM customer AS T1 INNER JOIN cust_order AS T2 ON T1.customer_id = T2.customer_id INNER JOIN shipping_method AS T3 ON T3.method_id = T2.shipping_method_id WHERE T1.first_name = 'Kaleena',,3,33.333333333333336,books#sep#cust_order [TAB] books#sep#customer#sep#customer [TAB] books#sep#shipping_method#sep#shipping_method
"Among all orders updated in 2022, identify the percentage that has been returned.",books,1,"SELECT CAST(SUM(CASE WHEN T1.status_value = 'Returned' THEN 1 ELSE 0 END) AS REAL) * 100 / COUNT(*) FROM order_status AS T1 INNER JOIN order_history AS T2 ON T1.status_id = T2.status_id WHERE STRFTIME('%Y', T2.status_date) = '2022'",,2,1.0733203233900197,books#sep#order_history#sep#order_history [TAB] books#sep#order_status#sep#order_status
"Among all addresses provided by customers, identify the percentage that are not in use anymore.",books,0,SELECT CAST(SUM(CASE WHEN T2.address_status = 'Inactive' THEN 1 ELSE 0 END) AS REAL) * 100 / COUNT(*) FROM customer_address AS T1 INNER JOIN address_status AS T2 ON T2.status_id = T1.status_id,,2,11.940298507462687,books#sep#address_status#sep#address_status [TAB] books#sep#customer_address#sep#customer_address
What is the average number of book pages written by Zilpha Keatley Snyder?,books,1,SELECT AVG(T3.num_pages) FROM book_author AS T1 INNER JOIN author AS T2 ON T1.author_id = T2.author_id INNER JOIN book AS T3 ON T3.book_id = T1.book_id WHERE T2.author_name = 'Zilpha Keatley Snyder',,3,214.25,books#sep#book_author#sep#book_author [TAB] books#sep#author#sep#author [TAB] books#sep#book#sep#book_language_and_pages2 [TAB] books#sep#book#sep#book_language_and_pages4 [TAB] books#sep#book#sep#book_language_and_pages7 [TAB] books#sep#book#sep#book_language_and_pages6 [TAB] books#sep#book#sep#book_language_and_pages1 [TAB] books#sep#book#sep#book_language_and_pages5 [TAB] books#sep#book#sep#book_language_and_pages0 [TAB] books#sep#book#sep#book_language_and_pages3
How many books were written by author A.J. Ayer?,books,1,SELECT COUNT(*) FROM book_author AS T1 INNER JOIN author AS T2 ON T1.author_id = T2.author_id WHERE T2.author_name = 'A.J. Ayer',,2,2.0,books#sep#book_author#sep#book_author [TAB] books#sep#author#sep#author
How many books were ordered by customer Kandy Adamec?,books,1,SELECT COUNT(*) FROM order_line AS T1 INNER JOIN cust_order AS T2 ON T2.order_id = T1.order_id INNER JOIN customer AS T3 ON T3.customer_id = T2.customer_id WHERE T3.first_name = 'Kandy' AND T3.last_name = 'Adamec',,3,1.0,books#sep#cust_order [TAB] books#sep#order_line [TAB] books#sep#customer#sep#customer
What is the percentage of books that cost greater than $10 and were ordered by customer Ruthanne Vatini?,books,1,SELECT CAST(SUM(CASE WHEN T1.price > 10 THEN 1 ELSE 0 END) AS REAL) * 100 / COUNT(*) FROM order_line AS T1 INNER JOIN cust_order AS T2 ON T2.order_id = T1.order_id INNER JOIN customer AS T3 ON T3.customer_id = T2.customer_id WHERE T3.first_name = 'Ruthanne' AND T3.last_name = 'Vatini',,3,50.0,books#sep#cust_order [TAB] books#sep#order_line [TAB] books#sep#customer#sep#customer
What is the sum of the number of pages of the books ordered by Mick Sever?,books,1,SELECT SUM(T1.num_pages) FROM book AS T1 INNER JOIN order_line AS T2 ON T1.book_id = T2.book_id INNER JOIN cust_order AS T3 ON T3.order_id = T2.order_id INNER JOIN customer AS T4 ON T4.customer_id = T3.customer_id WHERE T4.first_name = 'Mick' AND T4.last_name = 'Sever',,4,2140.0,books#sep#book#sep#book_language_and_pages2 [TAB] books#sep#book#sep#book_language_and_pages4 [TAB] books#sep#book#sep#book_language_and_pages7 [TAB] books#sep#book#sep#book_language_and_pages6 [TAB] books#sep#book#sep#book_language_and_pages1 [TAB] books#sep#book#sep#book_language_and_pages5 [TAB] books#sep#book#sep#book_language_and_pages0 [TAB] books#sep#book#sep#book_language_and_pages3 [TAB] books#sep#order_line [TAB] books#sep#cust_order [TAB] books#sep#customer#sep#customer
"Among the books purchased by less than 1 dollar, what is the difference between the number of books with less than 500 pages and books with greater than 500 pages?",books,1,SELECT SUM(CASE WHEN T1.num_pages < 500 THEN 1 ELSE 0 END) - SUM(CASE WHEN T1.num_pages > 500 THEN 1 ELSE 0 END) AS dif FROM book AS T1 INNER JOIN order_line AS T2 ON T1.book_id = T2.book_id WHERE T2.price < 1,,2,275.0,books#sep#book#sep#book_language_and_pages2 [TAB] books#sep#book#sep#book_language_and_pages4 [TAB] books#sep#book#sep#book_language_and_pages7 [TAB] books#sep#book#sep#book_language_and_pages6 [TAB] books#sep#book#sep#book_language_and_pages1 [TAB] books#sep#book#sep#book_language_and_pages5 [TAB] books#sep#book#sep#book_language_and_pages0 [TAB] books#sep#book#sep#book_language_and_pages3 [TAB] books#sep#order_line
How many inspections did All Style Buffet Restaurant have?,food_inspection_2,1,SELECT COUNT(T2.inspection_id) FROM establishment AS T1 INNER JOIN inspection AS T2 ON T1.license_no = T2.license_no WHERE T1.facility_type = 'Restaurant' AND T1.dba_name = 'All Style Buffet',,2,17.0,food_inspection_2#sep#inspection#sep#inspection_employee0 [TAB] food_inspection_2#sep#inspection#sep#inspection_employee2 [TAB] food_inspection_2#sep#inspection#sep#inspection_employee12 [TAB] food_inspection_2#sep#inspection#sep#inspection_employee14 [TAB] food_inspection_2#sep#inspection#sep#inspection_employee11 [TAB] food_inspection_2#sep#inspection#sep#inspection_employee3 [TAB] food_inspection_2#sep#inspection#sep#inspection_employee5 [TAB] food_inspection_2#sep#inspection#sep#inspection_employee9 [TAB] food_inspection_2#sep#inspection#sep#inspection_employee6 [TAB] food_inspection_2#sep#inspection#sep#inspection_employee16 [TAB] food_inspection_2#sep#inspection#sep#inspection_employee7 [TAB] food_inspection_2#sep#inspection#sep#inspection_employee8 [TAB] food_inspection_2#sep#inspection#sep#inspection_employee1 [TAB] food_inspection_2#sep#inspection#sep#inspection_employee15 [TAB] food_inspection_2#sep#inspection#sep#inspection_employee18 [TAB] food_inspection_2#sep#inspection#sep#inspection_employee4 [TAB] food_inspection_2#sep#inspection#sep#inspection_employee17 [TAB] food_inspection_2#sep#inspection#sep#inspection_employee13 [TAB] food_inspection_2#sep#inspection#sep#inspection_employee10 [TAB] food_inspection_2#sep#establishment#sep#establishment_identity0 [TAB] food_inspection_2#sep#establishment#sep#establishment_identity1
