question,db,lbl,sql,diff,related_tab_cnts,answer,related_tabs
"Among the male users, how many users use device model of Desire 820?",talkingdata,11,SELECT COUNT(T1.device_id) FROM gender_age AS T1 INNER JOIN phone_brand_device_model2 AS T2 ON T1.device_id = T2.device_id WHERE T2.device_model = 'Desire 820' AND T1.gender = 'M',,2,19.0,talkingdata#sep#phone_brand_device_model2#sep#phone_brand_device_model2 [TAB] talkingdata#sep#gender_age
"Among the users who are above 20, how many users use device model of ELIFE E7 Mini?",talkingdata,11,SELECT COUNT(T1.device_id) FROM gender_age AS T1 INNER JOIN phone_brand_device_model2 AS T2 ON T1.device_id = T2.device_id WHERE T2.device_model = 'ELIFE E7 Mini' AND T1.age > 20,,2,5.0,talkingdata#sep#phone_brand_device_model2#sep#phone_brand_device_model2 [TAB] talkingdata#sep#gender_age
State the number of users who are under 50 and above 20 use device model of Galaxy Premier.,talkingdata,11,SELECT COUNT(T1.device_id) FROM gender_age AS T1 INNER JOIN phone_brand_device_model2 AS T2 ON T1.device_id = T2.device_id WHERE T1.age BETWEEN 20 AND 50 AND T2.device_model = 'Galaxy Premier',,2,33.0,talkingdata#sep#phone_brand_device_model2#sep#phone_brand_device_model2 [TAB] talkingdata#sep#gender_age
Give the number of male users who use phone branded HTC.,talkingdata,11,SELECT COUNT(T1.device_id) FROM gender_age AS T1 INNER JOIN phone_brand_device_model2 AS T2 ON T1.device_id = T2.device_id WHERE T1.gender = 'M' AND T2.phone_brand = 'HTC',,2,315.0,talkingdata#sep#phone_brand_device_model2#sep#phone_brand_device_model2 [TAB] talkingdata#sep#gender_age
How many users who are between 20 and 60 use phone brand of TCL?,talkingdata,11,SELECT COUNT(T1.device_id) FROM gender_age AS T1 INNER JOIN phone_brand_device_model2 AS T2 ON T1.device_id = T2.device_id WHERE T1.age BETWEEN 20 AND 60 AND T2.phone_brand = 'TCL',,2,104.0,talkingdata#sep#phone_brand_device_model2#sep#phone_brand_device_model2 [TAB] talkingdata#sep#gender_age
How many people over the age of 50 do not have HTC One M8 Eye phones?,talkingdata,11,SELECT COUNT(T1.device_id) FROM gender_age AS T1 INNER JOIN phone_brand_device_model2 AS T2 ON T1.device_id = T2.device_id WHERE T1.age > 50 AND T2.device_model != 'One M8 Eye' AND T2.phone_brand != 'HTC',,2,1848.0,talkingdata#sep#phone_brand_device_model2#sep#phone_brand_device_model2 [TAB] talkingdata#sep#gender_age
How many users belong to the same behavior category as comics?,talkingdata,1,SELECT COUNT(T2.app_id) FROM label_categories AS T1 INNER JOIN app_labels AS T2 ON T1.label_id = T2.label_id WHERE T1.category = 'comics',,2,72.0,talkingdata#sep#label_categories#sep#label_categories [TAB] talkingdata#sep#app_labels
How many male users have the log of events at the same longitude of 114?,talkingdata,11,SELECT COUNT(T1.device_id) FROM gender_age AS T1 INNER JOIN events_relevant AS T2 ON T1.device_id = T2.device_id WHERE T2.longitude = 114 AND T1.gender = 'M',,2,0.0,talkingdata#sep#gender_age [TAB] talkingdata#sep#events_relevant#sep#events_relevant10 [TAB] talkingdata#sep#events_relevant#sep#events_relevant12 [TAB] talkingdata#sep#events_relevant#sep#events_relevant13 [TAB] talkingdata#sep#events_relevant#sep#events_relevant14 [TAB] talkingdata#sep#events_relevant#sep#events_relevant11 [TAB] talkingdata#sep#events_relevant#sep#events_relevant4 [TAB] talkingdata#sep#events_relevant#sep#events_relevant8 [TAB] talkingdata#sep#events_relevant#sep#events_relevant7 [TAB] talkingdata#sep#events_relevant#sep#events_relevant1 [TAB] talkingdata#sep#events_relevant#sep#events_relevant2 [TAB] talkingdata#sep#events_relevant#sep#events_relevant0 [TAB] talkingdata#sep#events_relevant#sep#events_relevant3 [TAB] talkingdata#sep#events_relevant#sep#events_relevant9 [TAB] talkingdata#sep#events_relevant#sep#events_relevant5 [TAB] talkingdata#sep#events_relevant#sep#events_relevant6
"How many of the apps belong in the ""Equity Fund"" category?",talkingdata,1,SELECT COUNT(T1.app_id) FROM app_labels AS T1 INNER JOIN label_categories AS T2 ON T1.label_id = T2.label_id WHERE T2.category = 'Equity Fund',,2,4.0,talkingdata#sep#label_categories#sep#label_categories [TAB] talkingdata#sep#app_labels
How many male users have a Galaxy Note 3?,talkingdata,11,SELECT COUNT(T1.device_id) FROM gender_age AS T1 INNER JOIN phone_brand_device_model2 AS T2 ON T1.device_id = T2.device_id WHERE T2.device_model = 'Galaxy Note 3' AND T1.gender = 'M',,2,577.0,talkingdata#sep#phone_brand_device_model2#sep#phone_brand_device_model2 [TAB] talkingdata#sep#gender_age
"How many keywords are there for season 9, episode 23 of law_and_order?",law_episode,1,SELECT COUNT(T2.keyword) FROM Episode AS T1 INNER JOIN Keyword AS T2 ON T1.episode_id = T2.episode_id WHERE T1.season = 9 AND T1.episode = 23,,2,28.0,law_episode#sep#Keyword#sep#Keyword [TAB] law_episode#sep#Episode#sep#Episode
How many keywords are there in the episode Disciple?,law_episode,1,SELECT COUNT(T2.keyword) FROM Episode AS T1 INNER JOIN Keyword AS T2 ON T1.episode_id = T2.episode_id WHERE T1.title = 'Disciple',,2,2.0,law_episode#sep#Keyword#sep#Keyword [TAB] law_episode#sep#Episode#sep#Episode
"How many nominations did Law and Order season 9, episode 20 get?",law_episode,11,SELECT COUNT(T2.award_id) FROM Episode AS T1 INNER JOIN Award AS T2 ON T1.episode_id = T2.episode_id WHERE T2.series = 'Law and Order' AND T1.season = 9 AND T1.episode = 20,,2,7.0,law_episode#sep#Award [TAB] law_episode#sep#Episode#sep#Episode
How many awards has Rene Balcer been nominated for?,law_episode,1,SELECT COUNT(T2.award_id) FROM Person AS T1 INNER JOIN Award AS T2 ON T1.person_id = T2.person_id WHERE T1.name = 'Rene Balcer',,2,6.0,law_episode#sep#Person#sep#Person [TAB] law_episode#sep#Award#sep#Award
"How many times is the number of keywords in ""Refuge: Part 1"" episode than ""Shield"" episode?",law_episode,0,SELECT CAST(SUM(CASE WHEN T1.title = 'Refuge: Part 1' THEN 1 ELSE 0 END) AS REAL) / SUM(CASE WHEN T1.title = 'Shield' THEN 1 ELSE 0 END) FROM Episode AS T1 INNER JOIN Keyword AS T2 ON T1.episode_id = T2.episode_id,,2,9.333333333333334,law_episode#sep#Keyword#sep#Keyword [TAB] law_episode#sep#Episode#sep#Episode
How many awards has Julia Roberts been nominated for?,law_episode,11,SELECT COUNT(T2.award_id) FROM Person AS T1 INNER JOIN Award AS T2 ON T1.person_id = T2.person_id WHERE T1.name = 'Julia Roberts' AND T2.result = 'Nominee',,2,1.0,law_episode#sep#Person#sep#Person [TAB] law_episode#sep#Award
"How many people, who were born in Canada, won an award in 1999?",law_episode,11,SELECT COUNT(T1.person_id) FROM Person AS T1 INNER JOIN Award AS T2 ON T1.person_id = T2.person_id WHERE T2.year = 1999 AND T1.birth_country = 'Canada',,2,2.0,law_episode#sep#Person#sep#Person [TAB] law_episode#sep#Award
"How many times did the episode titled ""Agony"" win an award?",law_episode,11,SELECT COUNT(T2.award_id) FROM Episode AS T1 INNER JOIN Award AS T2 ON T1.episode_id = T2.episode_id WHERE T1.title = 'Agony' AND T2.result = 'Winner',,2,5.0,law_episode#sep#Award [TAB] law_episode#sep#Episode#sep#Episode
"How many awards did the ""Agony"" win?",law_episode,11,SELECT COUNT(T2.award) FROM Episode AS T1 INNER JOIN Award AS T2 ON T1.episode_id = T2.episode_id WHERE T1.title = 'Agony' AND T2.result = 'Winner',,2,5.0,law_episode#sep#Award [TAB] law_episode#sep#Episode#sep#Episode
How many times was episode 20 of the Law and Order series nominated for the Primetime Emmy Awards in 1999?,law_episode,11,SELECT COUNT(T2.award_id) FROM Episode AS T1 INNER JOIN Award AS T2 ON T1.episode_id = T2.episode_id WHERE T2.year = 1999 AND T2.result = 'Nominee' AND T1.episode = 20 AND T2.organization = 'Primetime Emmy Awards' AND T1.series = 'Law and Order',,2,5.0,law_episode#sep#Award [TAB] law_episode#sep#Episode#sep#Episode
How many people from Canada are nominated for an award?,law_episode,10,SELECT COUNT(T1.person_id) FROM Person AS T1 INNER JOIN Award AS T2 ON T1.person_id = T2.person_id WHERE T1.birth_country = 'Canada',,2,6.0,law_episode#sep#Person#sep#Person [TAB] law_episode#sep#Award#sep#Award
How many allergies does Mrs. Saundra Monahan have?,synthea,1,SELECT COUNT(DISTINCT T2.code) FROM patients AS T1 INNER JOIN allergies AS T2 ON T1.patient = T2.PATIENT WHERE T1.prefix = 'Mrs.' AND T1.first = 'Saundra' AND T1.last = 'Monahan',,2,5.0,synthea#sep#allergies#sep#allergies_details6 [TAB] synthea#sep#allergies#sep#allergies_details3 [TAB] synthea#sep#allergies#sep#allergies_details14 [TAB] synthea#sep#allergies#sep#allergies_details2 [TAB] synthea#sep#allergies#sep#allergies_details10 [TAB] synthea#sep#allergies#sep#allergies_details8 [TAB] synthea#sep#allergies#sep#allergies_details13 [TAB] synthea#sep#allergies#sep#allergies_details0 [TAB] synthea#sep#allergies#sep#allergies_details11 [TAB] synthea#sep#allergies#sep#allergies_details12 [TAB] synthea#sep#allergies#sep#allergies_details9 [TAB] synthea#sep#allergies#sep#allergies_details5 [TAB] synthea#sep#allergies#sep#allergies_details1 [TAB] synthea#sep#allergies#sep#allergies_details4 [TAB] synthea#sep#allergies#sep#allergies_details7 [TAB] synthea#sep#patients
What is the total number of Asian patients who are allergic to peanuts?,synthea,11,SELECT COUNT(T2.patient) FROM allergies AS T1 INNER JOIN patients AS T2 ON T1.PATIENT = T2.patient WHERE T1.DESCRIPTION = 'Allergy to peanuts' AND T2.race = 'asian',,2,1.0,synthea#sep#allergies#sep#allergies_details6 [TAB] synthea#sep#allergies#sep#allergies_details3 [TAB] synthea#sep#allergies#sep#allergies_details14 [TAB] synthea#sep#allergies#sep#allergies_details2 [TAB] synthea#sep#allergies#sep#allergies_details10 [TAB] synthea#sep#allergies#sep#allergies_details8 [TAB] synthea#sep#allergies#sep#allergies_details13 [TAB] synthea#sep#allergies#sep#allergies_details0 [TAB] synthea#sep#allergies#sep#allergies_details11 [TAB] synthea#sep#allergies#sep#allergies_details12 [TAB] synthea#sep#allergies#sep#allergies_details9 [TAB] synthea#sep#allergies#sep#allergies_details5 [TAB] synthea#sep#allergies#sep#allergies_details1 [TAB] synthea#sep#allergies#sep#allergies_details4 [TAB] synthea#sep#allergies#sep#allergies_details7 [TAB] synthea#sep#patients#sep#patients_demographics0 [TAB] synthea#sep#patients#sep#patients_demographics1
How many times did Keven Kuhn receive DTaP immunization?,synthea,11,SELECT COUNT(T2.CODE) FROM patients AS T1 INNER JOIN immunizations AS T2 ON T1.patient = T2.PATIENT WHERE T1.first = 'Keven' AND T1.last = 'Kuhn' AND T2.DESCRIPTION = 'DTaP',,2,4.0,synthea#sep#immunizations#sep#immunizations0 [TAB] synthea#sep#immunizations#sep#immunizations14 [TAB] synthea#sep#immunizations#sep#immunizations1 [TAB] synthea#sep#immunizations#sep#immunizations11 [TAB] synthea#sep#immunizations#sep#immunizations5 [TAB] synthea#sep#immunizations#sep#immunizations6 [TAB] synthea#sep#immunizations#sep#immunizations4 [TAB] synthea#sep#immunizations#sep#immunizations13 [TAB] synthea#sep#immunizations#sep#immunizations3 [TAB] synthea#sep#immunizations#sep#immunizations7 [TAB] synthea#sep#immunizations#sep#immunizations12 [TAB] synthea#sep#immunizations#sep#immunizations8 [TAB] synthea#sep#immunizations#sep#immunizations15 [TAB] synthea#sep#immunizations#sep#immunizations10 [TAB] synthea#sep#immunizations#sep#immunizations2 [TAB] synthea#sep#immunizations#sep#immunizations9 [TAB] synthea#sep#patients#sep#patients_demographics0 [TAB] synthea#sep#patients#sep#patients_demographics1
How many of the male patients are allergic to house dust mites?,synthea,11,SELECT COUNT(DISTINCT T1.patient) FROM patients AS T1 INNER JOIN allergies AS T2 ON T1.patient = T2.PATIENT WHERE T2.DESCRIPTION = 'House dust mite allergy' AND T1.gender = 'M',,2,29.0,synthea#sep#allergies#sep#allergies_details6 [TAB] synthea#sep#allergies#sep#allergies_details3 [TAB] synthea#sep#allergies#sep#allergies_details14 [TAB] synthea#sep#allergies#sep#allergies_details2 [TAB] synthea#sep#allergies#sep#allergies_details10 [TAB] synthea#sep#allergies#sep#allergies_details8 [TAB] synthea#sep#allergies#sep#allergies_details13 [TAB] synthea#sep#allergies#sep#allergies_details0 [TAB] synthea#sep#allergies#sep#allergies_details11 [TAB] synthea#sep#allergies#sep#allergies_details12 [TAB] synthea#sep#allergies#sep#allergies_details9 [TAB] synthea#sep#allergies#sep#allergies_details5 [TAB] synthea#sep#allergies#sep#allergies_details1 [TAB] synthea#sep#allergies#sep#allergies_details4 [TAB] synthea#sep#allergies#sep#allergies_details7 [TAB] synthea#sep#patients
How many women need to take 'Nitroglycerin 0.4 MG/ACTUAT [Nitrolingual]'?,synthea,11,SELECT COUNT(DISTINCT T1.patient) FROM patients AS T1 INNER JOIN medications AS T2 ON T1.patient = T2.PATIENT WHERE T2.DESCRIPTION = 'Nitroglycerin 0.4 MG/ACTUAT [Nitrolingual]' AND T1.gender = 'F',,2,23.0,synthea#sep#patients [TAB] synthea#sep#medications
"From 7/9/2010 to 10/29/2013, how many black patients were immunized with the meningococcal MCV4P vaccine?",synthea,11,SELECT COUNT(DISTINCT T1.patient) FROM patients AS T1 INNER JOIN immunizations AS T2 ON T1.patient = T2.PATIENT WHERE T2.DESCRIPTION = 'meningococcal MCV4P' AND T2.DATE BETWEEN '2010-07-09' AND '2013-10-29' AND T1.race = 'black',,2,10.0,synthea#sep#immunizations#sep#immunizations0 [TAB] synthea#sep#immunizations#sep#immunizations14 [TAB] synthea#sep#immunizations#sep#immunizations1 [TAB] synthea#sep#immunizations#sep#immunizations11 [TAB] synthea#sep#immunizations#sep#immunizations5 [TAB] synthea#sep#immunizations#sep#immunizations6 [TAB] synthea#sep#immunizations#sep#immunizations4 [TAB] synthea#sep#immunizations#sep#immunizations13 [TAB] synthea#sep#immunizations#sep#immunizations3 [TAB] synthea#sep#immunizations#sep#immunizations7 [TAB] synthea#sep#immunizations#sep#immunizations12 [TAB] synthea#sep#immunizations#sep#immunizations8 [TAB] synthea#sep#immunizations#sep#immunizations15 [TAB] synthea#sep#immunizations#sep#immunizations10 [TAB] synthea#sep#immunizations#sep#immunizations2 [TAB] synthea#sep#immunizations#sep#immunizations9 [TAB] synthea#sep#patients#sep#patients_demographics0 [TAB] synthea#sep#patients#sep#patients_demographics1
How many male patients have been described as immune to quadrivalent HPV?,synthea,11,SELECT COUNT(DISTINCT T1.patient) FROM patients AS T1 INNER JOIN immunizations AS T2 ON T1.patient = T2.PATIENT WHERE T2.DESCRIPTION = 'HPV  quadrivalent' AND T1.gender = 'M',,2,90.0,synthea#sep#immunizations#sep#immunizations0 [TAB] synthea#sep#immunizations#sep#immunizations14 [TAB] synthea#sep#immunizations#sep#immunizations1 [TAB] synthea#sep#immunizations#sep#immunizations11 [TAB] synthea#sep#immunizations#sep#immunizations5 [TAB] synthea#sep#immunizations#sep#immunizations6 [TAB] synthea#sep#immunizations#sep#immunizations4 [TAB] synthea#sep#immunizations#sep#immunizations13 [TAB] synthea#sep#immunizations#sep#immunizations3 [TAB] synthea#sep#immunizations#sep#immunizations7 [TAB] synthea#sep#immunizations#sep#immunizations12 [TAB] synthea#sep#immunizations#sep#immunizations8 [TAB] synthea#sep#immunizations#sep#immunizations15 [TAB] synthea#sep#immunizations#sep#immunizations10 [TAB] synthea#sep#immunizations#sep#immunizations2 [TAB] synthea#sep#immunizations#sep#immunizations9 [TAB] synthea#sep#patients
How many different orders with a total price greater than 4000 are cancelled?,car_retails,11,SELECT COUNT(DISTINCT T1.orderNumber) FROM orderdetails AS T1 INNER JOIN orders AS T2 ON T1.orderNumber = T2.orderNumber WHERE T1.quantityOrdered * T1.priceEach > 4000 AND T2.status = 'Cancelled',,2,6.0,car_retails#sep#orderdetails#sep#orderdetails7 [TAB] car_retails#sep#orderdetails#sep#orderdetails8 [TAB] car_retails#sep#orderdetails#sep#orderdetails4 [TAB] car_retails#sep#orderdetails#sep#orderdetails9 [TAB] car_retails#sep#orderdetails#sep#orderdetails3 [TAB] car_retails#sep#orderdetails#sep#orderdetails13 [TAB] car_retails#sep#orderdetails#sep#orderdetails11 [TAB] car_retails#sep#orderdetails#sep#orderdetails12 [TAB] car_retails#sep#orderdetails#sep#orderdetails5 [TAB] car_retails#sep#orderdetails#sep#orderdetails6 [TAB] car_retails#sep#orderdetails#sep#orderdetails2 [TAB] car_retails#sep#orderdetails#sep#orderdetails0 [TAB] car_retails#sep#orderdetails#sep#orderdetails1 [TAB] car_retails#sep#orderdetails#sep#orderdetails10 [TAB] car_retails#sep#orders#sep#orders_status2 [TAB] car_retails#sep#orders#sep#orders_status3 [TAB] car_retails#sep#orders#sep#orders_status5 [TAB] car_retails#sep#orders#sep#orders_status0 [TAB] car_retails#sep#orders#sep#orders_status1 [TAB] car_retails#sep#orders#sep#orders_status4
How many Planes orders were there?,car_retails,1,SELECT COUNT(T1.productCode) FROM orderdetails AS T1 INNER JOIN products AS T2 ON T1.productCode = T2.productCode WHERE T2.productLine = 'Planes',,2,336.0,car_retails#sep#products#sep#ProductBasicInfo6 [TAB] car_retails#sep#products#sep#ProductBasicInfo1 [TAB] car_retails#sep#products#sep#ProductBasicInfo5 [TAB] car_retails#sep#products#sep#ProductBasicInfo3 [TAB] car_retails#sep#products#sep#ProductBasicInfo2 [TAB] car_retails#sep#products#sep#ProductBasicInfo0 [TAB] car_retails#sep#products#sep#ProductBasicInfo4 [TAB] car_retails#sep#orderdetails#sep#orderdetails7 [TAB] car_retails#sep#orderdetails#sep#orderdetails8 [TAB] car_retails#sep#orderdetails#sep#orderdetails4 [TAB] car_retails#sep#orderdetails#sep#orderdetails9 [TAB] car_retails#sep#orderdetails#sep#orderdetails3 [TAB] car_retails#sep#orderdetails#sep#orderdetails13 [TAB] car_retails#sep#orderdetails#sep#orderdetails11 [TAB] car_retails#sep#orderdetails#sep#orderdetails12 [TAB] car_retails#sep#orderdetails#sep#orderdetails5 [TAB] car_retails#sep#orderdetails#sep#orderdetails6 [TAB] car_retails#sep#orderdetails#sep#orderdetails2 [TAB] car_retails#sep#orderdetails#sep#orderdetails0 [TAB] car_retails#sep#orderdetails#sep#orderdetails1 [TAB] car_retails#sep#orderdetails#sep#orderdetails10
How many customers have an employee who reports to William Patterson as their sales representitive?,car_retails,1,SELECT COUNT(t1.customerNumber) FROM customers AS t1 INNER JOIN employees AS t2 ON t1.salesRepEmployeeNumber = t2.employeeNumber WHERE t2.firstName = 'William' AND t2.lastName = 'Patterson',,2,0.0,car_retails#sep#customers#sep#customers_sales3 [TAB] car_retails#sep#customers#sep#customers_sales0 [TAB] car_retails#sep#customers#sep#customers_sales4 [TAB] car_retails#sep#customers#sep#customers_sales1 [TAB] car_retails#sep#customers#sep#customers_sales2 [TAB] car_retails#sep#employees#sep#employees
How many sales representitives are based in the offices in the USA?,car_retails,11,SELECT COUNT(t1.employeeNumber) FROM employees AS t1 INNER JOIN offices AS t2 ON t1.officeCode = t2.officeCode WHERE t2.country = 'USA' AND t1.jobTitle = 'Sales Rep',,2,6.0,car_retails#sep#employees#sep#employees [TAB] car_retails#sep#offices
In how many counties is there a street called Appian Way?,restaurant,1,SELECT COUNT(DISTINCT T2.county) FROM location AS T1 INNER JOIN geographic AS T2 ON T1.city = T2.city WHERE T1.street_name = 'appian way',,2,2.0,restaurant#sep#geographic#sep#geographic5 [TAB] restaurant#sep#geographic#sep#geographic0 [TAB] restaurant#sep#geographic#sep#geographic7 [TAB] restaurant#sep#geographic#sep#geographic1 [TAB] restaurant#sep#geographic#sep#geographic2 [TAB] restaurant#sep#geographic#sep#geographic3 [TAB] restaurant#sep#geographic#sep#geographic8 [TAB] restaurant#sep#geographic#sep#geographic4 [TAB] restaurant#sep#geographic#sep#geographic6 [TAB] restaurant#sep#location#sep#location1 [TAB] restaurant#sep#location#sep#location10 [TAB] restaurant#sep#location#sep#location13 [TAB] restaurant#sep#location#sep#location15 [TAB] restaurant#sep#location#sep#location5 [TAB] restaurant#sep#location#sep#location12 [TAB] restaurant#sep#location#sep#location17 [TAB] restaurant#sep#location#sep#location9 [TAB] restaurant#sep#location#sep#location0 [TAB] restaurant#sep#location#sep#location14 [TAB] restaurant#sep#location#sep#location4 [TAB] restaurant#sep#location#sep#location3 [TAB] restaurant#sep#location#sep#location16 [TAB] restaurant#sep#location#sep#location11 [TAB] restaurant#sep#location#sep#location7 [TAB] restaurant#sep#location#sep#location6 [TAB] restaurant#sep#location#sep#location2 [TAB] restaurant#sep#location#sep#location8
Calculate the average rating of reviews for restaurants in Santa Cruz County.,restaurant,1,SELECT AVG(T2.review) FROM geographic AS T1 INNER JOIN generalinfo AS T2 ON T1.city = T2.city WHERE T1.county = 'santa cruz county',,2,2.29608695652174,restaurant#sep#geographic#sep#geographic5 [TAB] restaurant#sep#geographic#sep#geographic0 [TAB] restaurant#sep#geographic#sep#geographic7 [TAB] restaurant#sep#geographic#sep#geographic1 [TAB] restaurant#sep#geographic#sep#geographic2 [TAB] restaurant#sep#geographic#sep#geographic3 [TAB] restaurant#sep#geographic#sep#geographic8 [TAB] restaurant#sep#geographic#sep#geographic4 [TAB] restaurant#sep#geographic#sep#geographic6 [TAB] restaurant#sep#generalinfo#sep#generalinfo3 [TAB] restaurant#sep#generalinfo#sep#generalinfo5 [TAB] restaurant#sep#generalinfo#sep#generalinfo12 [TAB] restaurant#sep#generalinfo#sep#generalinfo8 [TAB] restaurant#sep#generalinfo#sep#generalinfo6 [TAB] restaurant#sep#generalinfo#sep#generalinfo1 [TAB] restaurant#sep#generalinfo#sep#generalinfo9 [TAB] restaurant#sep#generalinfo#sep#generalinfo16 [TAB] restaurant#sep#generalinfo#sep#generalinfo10 [TAB] restaurant#sep#generalinfo#sep#generalinfo0 [TAB] restaurant#sep#generalinfo#sep#generalinfo14 [TAB] restaurant#sep#generalinfo#sep#generalinfo2 [TAB] restaurant#sep#generalinfo#sep#generalinfo15 [TAB] restaurant#sep#generalinfo#sep#generalinfo13 [TAB] restaurant#sep#generalinfo#sep#generalinfo7 [TAB] restaurant#sep#generalinfo#sep#generalinfo11 [TAB] restaurant#sep#generalinfo#sep#generalinfo4
"How many Thai restaurants can be found in San Pablo Ave, Albany?",restaurant,11,SELECT COUNT(T1.id_restaurant) FROM generalinfo AS T1 INNER JOIN location AS T2 ON T1.id_restaurant = T2.id_restaurant WHERE T1.food_type = 'thai' AND T1.city = 'albany' AND T2.street_name = 'san pablo ave',,2,1.0,restaurant#sep#location#sep#location1 [TAB] restaurant#sep#location#sep#location10 [TAB] restaurant#sep#location#sep#location13 [TAB] restaurant#sep#location#sep#location15 [TAB] restaurant#sep#location#sep#location5 [TAB] restaurant#sep#location#sep#location12 [TAB] restaurant#sep#location#sep#location17 [TAB] restaurant#sep#location#sep#location9 [TAB] restaurant#sep#location#sep#location0 [TAB] restaurant#sep#location#sep#location14 [TAB] restaurant#sep#location#sep#location4 [TAB] restaurant#sep#location#sep#location3 [TAB] restaurant#sep#location#sep#location16 [TAB] restaurant#sep#location#sep#location11 [TAB] restaurant#sep#location#sep#location7 [TAB] restaurant#sep#location#sep#location6 [TAB] restaurant#sep#location#sep#location2 [TAB] restaurant#sep#location#sep#location8 [TAB] restaurant#sep#generalinfo#sep#generalinfo3 [TAB] restaurant#sep#generalinfo#sep#generalinfo5 [TAB] restaurant#sep#generalinfo#sep#generalinfo12 [TAB] restaurant#sep#generalinfo#sep#generalinfo8 [TAB] restaurant#sep#generalinfo#sep#generalinfo6 [TAB] restaurant#sep#generalinfo#sep#generalinfo1 [TAB] restaurant#sep#generalinfo#sep#generalinfo9 [TAB] restaurant#sep#generalinfo#sep#generalinfo16 [TAB] restaurant#sep#generalinfo#sep#generalinfo10 [TAB] restaurant#sep#generalinfo#sep#generalinfo0 [TAB] restaurant#sep#generalinfo#sep#generalinfo14 [TAB] restaurant#sep#generalinfo#sep#generalinfo2 [TAB] restaurant#sep#generalinfo#sep#generalinfo15 [TAB] restaurant#sep#generalinfo#sep#generalinfo13 [TAB] restaurant#sep#generalinfo#sep#generalinfo7 [TAB] restaurant#sep#generalinfo#sep#generalinfo11 [TAB] restaurant#sep#generalinfo#sep#generalinfo4
How many labels of the restaurant have an unknown country?,restaurant,1,SELECT COUNT(T1.label) FROM generalinfo AS T1 INNER JOIN geographic AS T2 ON T1.city = T2.city WHERE T2.county = 'unknown',,2,180.0,restaurant#sep#geographic#sep#geographic5 [TAB] restaurant#sep#geographic#sep#geographic0 [TAB] restaurant#sep#geographic#sep#geographic7 [TAB] restaurant#sep#geographic#sep#geographic1 [TAB] restaurant#sep#geographic#sep#geographic2 [TAB] restaurant#sep#geographic#sep#geographic3 [TAB] restaurant#sep#geographic#sep#geographic8 [TAB] restaurant#sep#geographic#sep#geographic4 [TAB] restaurant#sep#geographic#sep#geographic6 [TAB] restaurant#sep#generalinfo#sep#generalinfo3 [TAB] restaurant#sep#generalinfo#sep#generalinfo5 [TAB] restaurant#sep#generalinfo#sep#generalinfo12 [TAB] restaurant#sep#generalinfo#sep#generalinfo8 [TAB] restaurant#sep#generalinfo#sep#generalinfo6 [TAB] restaurant#sep#generalinfo#sep#generalinfo1 [TAB] restaurant#sep#generalinfo#sep#generalinfo9 [TAB] restaurant#sep#generalinfo#sep#generalinfo16 [TAB] restaurant#sep#generalinfo#sep#generalinfo10 [TAB] restaurant#sep#generalinfo#sep#generalinfo0 [TAB] restaurant#sep#generalinfo#sep#generalinfo14 [TAB] restaurant#sep#generalinfo#sep#generalinfo2 [TAB] restaurant#sep#generalinfo#sep#generalinfo15 [TAB] restaurant#sep#generalinfo#sep#generalinfo13 [TAB] restaurant#sep#generalinfo#sep#generalinfo7 [TAB] restaurant#sep#generalinfo#sep#generalinfo11 [TAB] restaurant#sep#generalinfo#sep#generalinfo4
